{
  "spec_version": "1.0",
  "signal": "stock_bond_correlation",
  "as_of": "2026-05-31",
  "available_at": "2026-06-15T14:00:00Z",
  "supersedes": null,
  "assumption_monitored": "bonds hedge equity drawdowns",
  "clock": "monthly",
  "assumption_state": {
    "status": "violated",
    "derivation": "DERIVED from the correlation, never standalone: corr < -0.10 intact, |corr| <= 0.10 under_test, corr > +0.10 violated. The +/-0.10 neutral band was pre-committed 2026-08-02 before looking and is not re-tunable."
  },
  "reading": {
    "value": 0.1494,
    "units": "pearson_correlation",
    "estimator": "causal 24-month trailing Pearson correlation of monthly equity and 10y-bond total returns",
    "context_band": "typical",
    "secondary_readings": [
      {
        "name": "level_z",
        "value": 0.1647,
        "units": "standard_deviations",
        "estimator": "causal expanding-window standardization of the 24m correlation"
      }
    ]
  },
  "rarity": {
    "level_percentile": 0.5267,
    "basis": "expanding",
    "window": null,
    "calibration": "expanding percentile mean 0.47 over 1963-2026. Note the status and the rarity disagree by design: the correlation is positive (violated) yet only mid-percentile, because the 1970s-80s were positive too. Violated is not the same as unprecedented."
  },
  "trend": {
    "level_percentile_change": -0.2633,
    "lookback_observations": 12,
    "direction": "falling"
  },
  "extreme_conditions": {
    "threshold_percentile": 0.95,
    "observations_at_or_above": 82,
    "share_of_history": 0.1093,
    "most_recent_such_date": "2025-01-31",
    "episodes": {
      "current_length": 51,
      "current_start": "2022-03-31",
      "length_units": "months",
      "major_episode_definition": "a contiguous violated run of >= 12 months",
      "major_episode_median_max": [
        51,
        129
      ]
    }
  },
  "cross_signal_relationships": [
    "Partially overlaps the volatility signal statistically; mechanistically distinct (PC2 inflation/real-rate vs PC1 risk-off) and kept separate per the mechanism gate.",
    "Read alongside volatility: a violated hedge assumption in a calm market and in a stressed one are different environments, and neither reading substitutes for the other.",
    "Descriptive only: this reports the realized correlation state. It does not forecast when the sign will flip and does not claim the flip is forecastable."
  ],
  "assessment": {
    "mechanism": "pass",
    "measurement_validity": "H",
    "investment_usefulness": "H",
    "evidence_maturity": "M"
  },
  "maturity": "research"
}
