{
  "spec_version": "1.0",
  "signal": "volatility",
  "as_of": "2026-05-29",
  "available_at": "2026-05-30T09:15:00Z",
  "clock": "daily",
  "assumption_monitored": "N/A because volatility is a context axis, not an assumption-monitor: it colours how every other signal reads and carries no intact/violated status.",
  "reading": {
    "value": null,
    "units": "annualised_volatility",
    "estimator": "EWMA lambda=0.94 on daily log returns, 252d burn-in",
    "undefined_reason": "GARCH persistence alpha+beta >= 1 (IGARCH guard) \u2014 half-life undefined for this era"
  },
  "rarity": {
    "level_percentile": 0.5187,
    "basis": "expanding",
    "window": null
  },
  "assessment": {
    "mechanism": "pass",
    "measurement_validity": "H",
    "investment_usefulness": "H",
    "evidence_maturity": "H"
  },
  "maturity": "research"
}
